[
  {
    "id": "PRD-0001",
    "ficticio": true,
    "origem": "demo",
    "criadoEm": "2026-10-01T12:00:00.000Z",
    "atualizadoEm": "2026-10-01T12:00:00.000Z",
    "criadoPor": "humano",
    "descricao": "Conjunto privativo hospitalar (demo)",
    "categoria": "privativo_hospitalar",
    "codigoErp": null,
    "precoAutorizado": 89.9,
    "precoFonte": "tabela fictícia de demonstração",
    "custoVariavelUnitario": 41,
    "custoFonte": "custo fictício de demonstração",
    "certificacoes": [],
    "ativo": true
  },
  {
    "id": "PRD-0002",
    "ficticio": true,
    "origem": "demo",
    "criadoEm": "2026-10-01T12:00:00.000Z",
    "atualizadoEm": "2026-10-01T12:00:00.000Z",
    "criadoPor": "humano",
    "descricao": "Jaleco profissional bordado (demo)",
    "categoria": "jaleco",
    "codigoErp": null,
    "precoAutorizado": 119,
    "precoFonte": "tabela fictícia de demonstração",
    "custoVariavelUnitario": null,
    "custoFonte": "componentes fictícios",
    "componentesCusto": {
      "tecido": 28.5,
      "aviamentos": 4.2,
      "costura": 18,
      "bordado": null,
      "embalagem": 1.1
    },
    "certificacoes": [],
    "ativo": true
  },
  {
    "id": "PRD-0003",
    "ficticio": true,
    "origem": "demo",
    "criadoEm": "2026-10-01T12:00:00.000Z",
    "atualizadoEm": "2026-10-01T12:00:00.000Z",
    "criadoPor": "humano",
    "descricao": "Camisa polo bordada (demo)",
    "categoria": "camiseta_polo",
    "codigoErp": null,
    "precoAutorizado": 54,
    "precoFonte": "tabela fictícia de demonstração",
    "custoVariavelUnitario": 23.5,
    "custoFonte": "custo fictício de demonstração",
    "certificacoes": [],
    "ativo": true
  },
  {
    "id": "PRD-0004",
    "ficticio": true,
    "origem": "demo",
    "criadoEm": "2026-10-01T12:00:00.000Z",
    "atualizadoEm": "2026-10-01T12:00:00.000Z",
    "criadoPor": "humano",
    "descricao": "Macacão operacional com refletivo (demo)",
    "categoria": "macacao",
    "codigoErp": null,
    "precoAutorizado": null,
    "precoFonte": null,
    "custoVariavelUnitario": 62,
    "custoFonte": "custo fictício de demonstração",
    "certificacoes": [],
    "ativo": true
  }
]
